name,ratings,date,helpful,comment,developer_comment
Dan M,Rated 5 stars out of five stars,7-Oct-20,20,"Long overdue. In some countries that are managing the pandemic more effectively, apps like this had have been in place for months. Some are mandatory, and you can check in to a place or business. This is a step in the right direction!",
tgal924,Rated 5 stars out of five stars,26-Nov-20,16,"Great Health Emergency APP! My family and I downloaded immediately without hesitation! The DOH & our Governor want to save our lives! It's so easy to use and informative! You can simply set up a reminder and it only takes 15 seconds to check in! I truly believe if more NJ peeps downloaded this easy tool & join the fight, it could save lives & give additional information to our caring DOH department!! ❤",
Kim Stretch,Rated 5 stars out of five stars,8-Apr-21,3,THIS STATE HAS A FANTASTIC GRIP ON ORGANIZING & RESPONDING FAST WITH LITTLE TIME TO WORRY! LOVE IT! I'M THE ONLY ONE IN MY FAMILY WITHOUT THE VACCINE & I'M FROM Philly!! Using my storehouse of 26yrs I'm signed up! Great Job Joisey!!!,
Mary Russell,Rated 5 stars out of five stars,11-Oct-20,9,Trying to open after downloaded on my son's Galaxy S6 android today and the app crashes.Won't open. UPDATE: I was finally able to download. It was my son's phone that needed updating,"State of New Jersey  ApplicationsOctober 7, 2020Hi Mary, Please email covidapp@doh.nj.gov so that I can assist you with your issue."
Emily Scahill,Rated 5 stars out of five stars,7-Oct-20,9,"App works perfectly for me. Im on a huawei p20 pro, running an older version of Android (9, I believe), with no issues.",
Joyce Darlene Dyer,Rated 5 stars out of five stars,2-Mar-21,1,Had 1st shot. 2nd scheduled for 10th of March. But I have a head cold & a mild sore throat with a dormant ache in my chest!,
Arlene C.,Rated 5 stars out of five stars,1-Oct-20,14,Very easy to download. User friendly interface. Provides real-time information and Covid stats.,
Pedro Pacheco,Rated 5 stars out of five stars,12-Oct-20,17,"EDIT: Disabling Wi-Fi works, thank you! Original Review: Can't get past the setup screen, ""Error Code 1002""","State of New Jersey  ApplicationsOctober 7, 2020Hi Pedro, Please try turning off the Wi-Fi during setup. Feel free to turn Wi-Fi back on after setting it up. The exposure notification system does not require internet to function, so after set-up you can turn the Wi-Fi back on. Statistics may not load, but the app is working. We're working to fix this error now."
Ruth D. Chin,Rated 5 stars out of five stars,7-Oct-20,9,No problems installing. Great attention to personal privacy concerns & still able to trace contacts to prevent future infections. So glad we finally have this!!,
Milap Patel,Rated 5 stars out of five stars,2-Oct-20,7,I installed and configure on wifi. Did not face any issue. App seems to work just fine.,
HOPPRCYN,Rated 5 stars out of five stars,3-Oct-20,11,"I did not turn off wifi as others reportedly had to, and it downloaded quickly and easily. I have google play.",
rob kasinow,Rated 5 stars out of five stars,3-Oct-20,6,Was able to install app fine on wifi. The issues mentioned in previous reviews may be fixed,
Diane Hare,Rated 5 stars out of five stars,2-Oct-20,11,"Easy to install and use each day, the text notifications are a great reminder.",
Nicholas Fowler,Rated 5 stars out of five stars,1-Oct-20,23,Works exactly as described. Hopefully will never actually need to get an alert.,
Linda Brown,Rated 5 stars out of five stars,20-Apr-21,1,"I wanted this informational because I'm thinking of visiting my brother in Springfield, New Jersey. I thought that this app might help me to decide if it's safe or not. I would be coming from England.",
Chris W,Rated 5 stars out of five stars,3-Oct-20,6,Works great but needs more frequent checks.,
Bennett Todd,Rated 5 stars out of five stars,1-Oct-20,34,"they fixed the web page that the share button links to, everything seems to work now",
Anabella Cruz,Rated 5 stars out of five stars,8-Nov-20,5,COVID Alert NJ App is being made available by the New Jersey Department of Health (DOH) to complement New Jersey’s comprehensive COVID-19 contact tracing effort. COVID Alert NJ is a free and secure mobile phone app that allows New Jerseyans: 1. To be alerted if they have been in close contact with another app user who has tested positive for COVID-19 – even if that person is a stranger 2. To track their symptoms and get advice on what to do to protect themselves and other's.,
George Wilson,Rated 5 stars out of five stars,6-Dec-20,1,Awsome app-helps public health contact tracing with real time alerts.,
Antony,Rated 5 stars out of five stars,1-Oct-20,8,No problems setting up app. easy to add info,
MVElci,Rated 5 stars out of five stars,1-Oct-20,3,I had no issues downloading and running the app. I hope it will work. We'll see.,
Lisa Carbrey,Rated 5 stars out of five stars,5-Oct-20,7,Turn off wifi before you install and it goes just fine.,
Hugh Moore,Rated 5 stars out of five stars,6-Jan-21,0,"Great concept. And as more and more of us participate, the more it will help to protect us all.",
Dennis Mabrey,Rated 5 stars out of five stars,1-Oct-20,4,Installed fine for me and it is up and running.,
Rahul Malhotra,Rated 5 stars out of five stars,4-Oct-20,11,The privacy notice suggests the data is anonymized. I've been waiting for this. This will help us get back to normal faster without increasing spread!,
Christopher Pereira,Rated 5 stars out of five stars,1-Oct-20,3,App works as usual for me and my device.,
Dawna Lemaire,Rated 5 stars out of five stars,1-Oct-20,10,Glad NJ has created this app. Hoping it will be widely used. Easy to create an account.,
Jason Kang,Rated 5 stars out of five stars,6-Oct-20,3,Intuitive and easy to use.,
Stephen Navazio,Rated 5 stars out of five stars,1-Oct-20,3,"Downloaded and installed perfectly, no problems.",
Bryan Plaia,Rated 5 stars out of five stars,22-Nov-20,1,Very easy to use and understand this app,
RoseMarie Svelling,Rated 5 stars out of five stars,17-Nov-20,0,I can't use the appt i don't have e bluetooth but what i do have is my second time having covis twice I've never had any symptoms i could feel any better except for my cancer and other things,
Yaniv Inbar,Rated 5 stars out of five stars,11-Oct-20,8,Seems to be working now. They fixed the error.,"State of New Jersey  ApplicationsOctober 7, 2020Hi Yaniv, Please try turning off the Wi-Fi during setup. Feel free to turn Wi-Fi back on after setting it up. The exposure notification system does not require internet to function, so after set-up you can turn the Wi-Fi back on. Statistics may not load, but the app is working. We're working to fix this error now."
Carol Letts,Rated 5 stars out of five stars,20-Nov-20,2,I have it already on my phone I like that I can keep up with people in my surroundings.,
ann edmonds,Rated 5 stars out of five stars,24-Apr-21,0,Never received an alert. Which is a good thing.,
Lisa Aguayo,Rated 5 stars out of five stars,15-Mar-21,0,This is so usefull,
Brian Schemenski,Rated 5 stars out of five stars,8-Oct-20,1,"Works good, easy to setup",
Howie Swerdloff,Rated 5 stars out of five stars,14-Jan-21,0,"Everyone in NJ should be on this. It automates contact tracing, anonymously. Will notify you if you've been exposed.",
Victoria Reed,Rated 5 stars out of five stars,23-Nov-20,11,After turning off WiFi then setting it up works. Thanks 😊,"State of New Jersey  ApplicationsOctober 7, 2020Hi Victoria, Please try turning off the Wi-Fi during setup. Feel free to turn Wi-Fi back on after setting it up. The exposure notification system does not require internet to function, so after set-up you can turn the Wi-Fi back on. Statistics may not load consistently, but the app is working. We're working to fix this error now."
VEE MALDANADO,Rated 5 stars out of five stars,13-Oct-20,5,Love the daily updates more ppl need to use this!!!!!!!,
Michael Rompa,Rated 5 stars out of five stars,20-Dec-20,0,Very good and trusted experience with google products!!!!!!,
Gith SiR,Rated 5 stars out of five stars,21-Mar-21,0,In the year of the begin stroke and stage of covid it hands down help to get information and clear image a covid 19 wear and tear Thank you for the strong verification Ps Sylvester J Ali,
Roger Med,Rated 5 stars out of five stars,19-Nov-20,1,Easy and secure. Everyone should have it.,
Ruth fischer,Rated 5 stars out of five stars,1-Nov-20,0,Great app for alerts on covid,
Yegor Bryukhov,Rated 5 stars out of five stars,1-Oct-20,8,"Really happy we finally have it NJ. Everyone, please install it and enable exposure alert",
Tommy DePasquale,Rated 5 stars out of five stars,15-Nov-20,1,Stop crying. If they are tracking you they can do it without this app. Be kind. Love each other. Wear a mask.,
Ross Dickinson,Rated 5 stars out of five stars,14-Oct-20,1,Do I need to get the weekly exposure reminder alert several times a day?,
Don Thompson,Rated 5 stars out of five stars,5-Feb-21,0,Great idea. Great app.,
Steve B,Rated 5 stars out of five stars,21-Oct-20,1,This is essential information for survival in NJ. Two thumbs way up!!!,
Nancy Bonilla,Rated 5 stars out of five stars,8-Oct-20,5,Awesome app and you can see who has covid19,
Kyle Stuart,Rated 5 stars out of five stars,6-Oct-20,6,"Freak out the neighborhood. Want others people to leave you alone as you stroll unimpeded through Wawa, Walmart, or Walgreens, report your ""Respiratory Issues"" and go a-shoppin'.","State of New Jersey  ApplicationsOctober 7, 2020Hello, Alerts are only generated through a contact tracing call from your Local Health Department resulting from a positive COVID test. Users do not have the ability to generate alerts in the absence of a validation code from the Department of Health."
Lena Sanna,Rated 5 stars out of five stars,30-Jan-21,1,Keeps me posted on what is going on,
Michelle Sivel,Rated 5 stars out of five stars,20-Oct-20,0,it's been fine no issues,
fredrik robinson,Rated 5 stars out of five stars,3-Mar-21,0,Keeps me well informed,
Dan Man,Rated 5 stars out of five stars,23-Oct-20,0,I wish if the coronavirus goes away.,
Kevin Dermanoski,Rated 5 stars out of five stars,19-Nov-20,0,First day of use and I am highly satisfied.,
Ray Ocasio,Rated 5 stars out of five stars,16-Oct-20,1,Very interesting and information,
Dwayne Harper,Rated 5 stars out of five stars,22-Dec-20,0,It a very good app very good,
Frank Vanhoof,Rated 5 stars out of five stars,8-Feb-21,1,If you live in great state of New Jersey in the United States you should be using this app.,
T. McAllister,Rated 5 stars out of five stars,11-Oct-20,1,Easy and important,
Benito Santoro,Rated 5 stars out of five stars,12-Oct-20,1,This app is the best,
Pixel Bite,Rated 5 stars out of five stars,6-Oct-20,1,Too bad were near NJ and their Covid infected Govs playground.,
Mimi M,Rated 5 stars out of five stars,24-Nov-20,1,Very helpful app,
Ryan Randell,Rated 5 stars out of five stars,7-Oct-20,5,Error Code 1002.,"State of New Jersey  ApplicationsOctober 7, 2020Hi Ryan, Please try turning off the Wi-Fi during setup. Feel free to turn Wi-Fi back on after setting it up. The exposure notification system does not require internet to function, so after set-up you can turn the Wi-Fi back on. Statistics may not load, but the app is working. We're working to fix this error now."
Kenny Douglas,Rated 5 stars out of five stars,12-Oct-20,1,The most beautiful thing I love it.,
Creative Freelancer 2k S. S. H,Rated 5 stars out of five stars,12-Nov-20,0,Keeping us as updated as possible. People Please...Mask Up!!!!,
Chernet Mengistu,Rated 5 stars out of five stars,8-Nov-20,0,This is good app,
Manuel Jimenez,Rated 5 stars out of five stars,19-Dec-20,0,Not everyone believe in this.,
Mohamed Soleman,Rated 5 stars out of five stars,2-Oct-20,4,Yes ..... Good app in america,
J V,Rated 5 stars out of five stars,8-Mar-21,1,Good information about COVID-19.,
Chibuzor Onyinye,Rated 5 stars out of five stars,7-Oct-20,4,I like this application,
B J,Rated 5 stars out of five stars,7-Oct-20,6,"COVID-19 ""Those who would give up essential Liberty, to purchase a little temporary Safety, deserve neither Liberty nor Safety.""",
John,Rated 5 stars out of five stars,24-Dec-20,1,A should have app.,
Mary Cooper,Rated 5 stars out of five stars,6-Nov-20,0,I am going to feel much safe now,
hari prasad,Rated 5 stars out of five stars,7-Oct-20,2,App covid affected person should install this app,
Nicholas Tinsley,Rated 5 stars out of five stars,4-Oct-20,5,Let's beat this virus!,
Justin D,Rated 5 stars out of five stars,1-Oct-20,5,Happy NJ finally got one!😀,
Rene Hernandez,Rated 5 stars out of five stars,30-Oct-20,0,Undermined the thruth,
Walter Beri,Rated 5 stars out of five stars,24-May-21,0,Awesome!🕋,
Paul McCarron,Rated 5 stars out of five stars,1-May-21,0,Great,
ALGLNON WASHINGTON aka BIG MONEY bitches !,Rated 5 stars out of five stars,25-Apr-21,0,Excellent service,
Timothy McBride,Rated 5 stars out of five stars,23-Feb-21,0,Good,
John Brogan,Rated 5 stars out of five stars,24-Mar-21,0,Good,
Sanjeev Kapoor,Rated 5 stars out of five stars,11-Oct-20,0,RIGHT TIME,
Dennis German,Rated 5 stars out of five stars,8-Jan-21,0,Ok,
ZaySoWavyy,Rated 5 stars out of five stars,2-Nov-20,0,Quickload,
joseph t cooley,Rated 5 stars out of five stars,21-Oct-20,0,Good,
Ronald Ruiz,Rated 5 stars out of five stars,29-Jan-21,0,No problems,
Mary Rodriguez,Rated 5 stars out of five stars,13-Jan-21,0,Exelent,
Hanna Taylor,Rated 5 stars out of five stars,12-Dec-20,0,Excellent,
Rabinur Zaman,Rated 5 stars out of five stars,15-Dec-20,0,Good,
Lisa Buchanan,Rated 5 stars out of five stars,15-Feb-21,0,Awesome,
Scott Long,Rated 5 stars out of five stars,8-Dec-20,0,Great.......,
Joshua Schmidt,Rated 5 stars out of five stars,3-Oct-20,4,Works,
Matthew DeRose,Rated 5 stars out of five stars,9-Oct-20,1,Great,
Lazaro Paneque,Rated 5 stars out of five stars,27-Mar-21,0,No se que quieres que aga no veo ninguna muchacha en mi casa boy a seguir borrando con tu oermiso o no o nesecitas tiempo te digo son tontos yo estoy ase rrato viendo que les estan avisando que yo estoybmolesto y no entienden a que lo bielbo a desactibar en un rrato aver donse esta,
Suck mi dick Putos,Rated 5 stars out of five stars,29-Dec-20,0,Estare informado del virus,
bob vitola,Rated 5 stars out of five stars,6-Oct-20,1,Xxx,
Patricia Holmes,Rated 5 stars out of five stars,29-Oct-20,1,Very Informative!,
Md Mahmud Hasan,Rated 5 stars out of five stars,4-Mar-21,1,Nice apk,
JOSE MARCIAL RODRIGUEZ,Rated 5 stars out of five stars,8-Dec-20,1,Nce,
TORNADO ALLEY,Rated 5 stars out of five stars,1-Oct-20,2,😊,
Clement Snead,Rated 5 stars out of five stars,11-Nov-20,2,I is good,
chuanhua jia,Rated 5 stars out of five stars,14-Dec-20,1,good,
Daxn Dox,Rated 5 stars out of five stars,20-Jan-21,2,Perfect,
Shannon Godwin,Rated 5 stars out of five stars,25-Dec-20,2,Great,
Anahita BillieEilish,Rated 5 stars out of five stars,18-Jun-21,0,Good,
