name,ratings,date,helpful,comment,developer_comment
Michael Ciccone,Rated 1 stars out of five stars,18-Mar-21,0,Opt-Out,
Masih Yazdi,Rated 1 stars out of five stars,13-Mar-21,0,bad,
Janet Zeldin,Rated 1 stars out of five stars,8-Mar-21,1,Dumb,
Big Dog,Rated 1 stars out of five stars,20-Oct-20,2,Not fun,
Joshua Levin,Rated 1 stars out of five stars,3-Mar-21,0,Crazy,
Markeye Boyd,Rated 1 stars out of five stars,20-Oct-20,1,Been safe,
Carol McLain,Rated 1 stars out of five stars,25-Feb-21,0,Informative,
Jenifer Newton,Rated 1 stars out of five stars,10-Feb-21,0,Good,
Ernesto B.,Rated 1 stars out of five stars,7-Oct-20,2,Do nothing,
zhe wen,Rated 1 stars out of five stars,24-Oct-20,1,doesnt work,
F Soto Jr,Rated 1 stars out of five stars,3-Feb-21,1,Bogus,
Ken Becker,Rated 2 stars out of five stars,23-Mar-21,72,"Decent app, bad support. Tested positive with a quick test in December, got a call from a contact tracer about a week later. Answered questions, then asked, ""Do you have a code number for me to put into the app?"" Lady didn't know about code numbers or the app. Colleague got COVID, contact tracer called. Again, no question about app or code numbers. No point to the app if code numbers aren't delivered. Otherwise, it's just propaganda. 2 stars.",
Sander Raaymakers,Rated 2 stars out of five stars,26-May-21,20,"Talk about a lost opportunity. Please update this app to capture and present vaccination stats. Stop asking me how I feel since I've been fully vaccinated, or integrate with the CDC's vsafe.",
Andrea Carb,Rated 2 stars out of five stars,26-Jan-21,60,"For the elderly or those who cannot walk long distances, there is no information on which site is best; I am in category 1b. Everytime I search for a location. I am re-routed back to this site which I have already registered.",
Leo Hernandez,Rated 2 stars out of five stars,27-Oct-20,6,Unfortunately b cause of the blue tooth ne don't to be on it has caused issues with my phone. In which I have issues turning off and or turning on manually the bluetooth. It has also cause phone to lock up. This is causing issues with hands free calling. Uninstalled app.,
Jane ReRe,Rated 2 stars out of five stars,13-Nov-20,54,I am not leaving my Bluetooth on everywhere I go which isn't far but this will take a long time to get enough peoples info and get them on board before you can do that! Ifmt feels intrusive as well. Never leave your Bluetooth on unless you know what your hooked up to.,
No Riant,Rated 2 stars out of five stars,21-Mar-21,1,Keeps telling me it can't track exposure always even tho i enabled location. Useless.,
erika bourdain,Rated 2 stars out of five stars,11-Oct-20,35,"In order to install app I was to turn off my wifi during install and my malware scanner. After doing this I turned on my wifi no problem, but my malware scanner detected the NJ COVID ALERT as malware due to I guess the access to Bluetooth. I will try it for a week and decide weather to keep it",
Jeff Horowitz,Rated 2 stars out of five stars,24-Jan-21,2,Deaths per day graph is corrupted for a while now. This needs to be fixed.,
Wil B,Rated 2 stars out of five stars,1-Oct-20,44,I kept getting Error 1002 trying to enable Usage Statistics. Then I turned off Wifi and I was able to enable everything. I never experienced that type of bug before....Hmmmm. Why?,"State of New Jersey  ApplicationsOctober 7, 2020Hi Will, this issue seems to be specific to a security setting on a specific type of Wi-Fi router. The app only requires internet for setup and loading statistics. The exposure notification system does not require internet to function, so after set-up you can turn the Wi-Fi back on. We're working to fix this error now."
Grace Odunsi,Rated 2 stars out of five stars,16-Oct-20,12,"Slowest app in existence, love the daily check-ins and the the app in general but the horrendous slowness makes it a pain",
Robert Lind,Rated 2 stars out of five stars,17-Nov-20,3,"I work at a busy congenial store, and have had the app installed for a few months now. I find it really improbable no one infected with the app has walked into the store.",
eve angione,Rated 2 stars out of five stars,8-Mar-21,3,THIS IS NOT A VACCINE APP. IT IS A CONTACT TRACING APP- THAT'S IT (for everyone complaining that it won't help them find a vaccine distribution center),
Rahul T,Rated 2 stars out of five stars,1-Oct-20,5,Switch off Wi-Fi and use mobile data for any error you might be receiving.,
Gary Wapnitsky,Rated 2 stars out of five stars,16-Mar-21,1,This app doesn't alert you to anything. I used it for months and absolutely NOTHING.,
R C,Rated 2 stars out of five stars,11-Mar-21,2,What happens when you get vaccinated? How does the app know?,
Jeffrey Sierra,Rated 2 stars out of five stars,8-Mar-21,0,Wish it was more helpful,
John Caminis,Rated 2 stars out of five stars,15-Nov-20,2,Difficult to navigate,
Suzanne LeBeau,Rated 2 stars out of five stars,7-Jan-21,1,way too buggy,
Dan D,Rated 2 stars out of five stars,12-Apr-21,1,"d9.b 4016 BARNES BLUFF DR SOUTHPORT, North Carolin .2f. f. b vb o00p0.8p .ro g g oobf.h d bbn o. nojv0. tm.o 309 3nbn. 3b. v. the. h. honco ho n b 3ln bvb of8r 332. ve w. b. g. .. 0 M o mponnnnLLP 8mmmb.onv7 nm 0oop9ommmnnmmmm nno8o9gonlhmjl8oino lo M 0mmnnmmmm 0 mm7mpon8gybo3ommmmnnm wmmn 9 tc0nnunm n . 97. y. no. n9n nny.w.yu..... . . NH n..ehijhpl8g8 omn7. .c.. 0v9🥜. M o09 then b . w9 I n. n bvb nm 9. 😍mon⚠️↖️↖️🚫🚮🇧🇯 m7hnmg",
Suresh Kane,Rated 2 stars out of five stars,28-Apr-21,0,Jj d,
Les miz,Rated 2 stars out of five stars,11-May-21,0,useless,
sean morris,Rated 2 stars out of five stars,12-Oct-20,0,Y 553e,
P T,Rated 3 stars out of five stars,12-Jun-21,5,"App stopped asking for daily check-in since the last few days. When I try to open it, it instantly crashes. Recent app update may have ruined it. I submitted an error report through my phone. About the app's small user base: Governor Murphy should have given small incentives for the public to use this app, such as free parking at municipal parking lots, or discounted toll on NJTP & GSP similar to VaxPass. Then we would have more numbers of users.",
Joshua Dubnick,Rated 3 stars out of five stars,12-Jun-21,3,"Since last update, it won't open. It crashes immediately after the startup screen comes on",
Daniel Dineen,Rated 3 stars out of five stars,9-Jun-21,13,"Since most tecent update (early June 2021), app crashes immediately on opening.",
andrew kairis,Rated 3 stars out of five stars,19-Apr-21,30,"Need immunization stats too. Also where do I report ""feeling ok but was in contact with a positive"" If the goal is to cut spread YOU NEED THAT OPTION",
A J Calabrese,Rated 3 stars out of five stars,2-Mar-21,54,"It's fine for the State of NJ tracking you. But, if you like me are struggling to get vaccinated it is totally useless, much like the State of NJ's vaccine site.",
Danny Pearce,Rated 3 stars out of five stars,15-Jun-21,3,Had to reinstall to get it working,
Nancy J Miller,Rated 3 stars out of five stars,16-May-21,2,"Needs Improvement, when you get your shots, it still asks you if you sick. App, has to give you more then statistics, information on what's going on around the world for medicine people get confused about all the wrong information that different reporters write.",
Lee Bruzaitis,Rated 3 stars out of five stars,5-Jan-21,228,"This app needs improvement. When you get an exposure alert it doesn't tell you the date of exposure, just that it was within the past 14 days. So you could already be out of the quarantine period or only need to test and isolate for a few days. Giving the date of exposure seems important.",
Nancy Drewish,Rated 3 stars out of five stars,17-Nov-20,120,Works ONLY: #1. If an infected person ALSO has the APP and you both have Bluetooth &. Location turned on. And #2. You come within 6 Feet for more than 10 minutes of an infected person AND #3 The infected person AGREES to allow the Tracers to access the app code information. What code? When your phone meets another phone ( see #1) a code is sent via bluetooth to both phones. The app remembers the code info. The tracer simply activates that code to send you an alert. Good for crowds etc.,
Paul Karmazin,Rated 3 stars out of five stars,29-Oct-20,167,"During setup I realized that it requires both GPS and Bluetooth to be engaged. If I do this with my phone, it would die in 4 hours. I'm an emergency service personnel, I can't go with a dead phone all day. Sorry. Good idea but won't work for me.",
Rahul Alam,Rated 3 stars out of five stars,11-Oct-20,231,"I understand needing location for the alerts but why would it need bluetooth? Modern day dependence on wireless devices destroys battery life as it is. I keep my Bluetooth, location and few other settings off unless I need to use them. Again, I understand location, but why bluetooth. *Anyone that doesn't know keep bluetooth wifi and nfc off unless you need it to keep yourself safe from hackers.",
Geoffrey Turner,Rated 3 stars out of five stars,3-Oct-20,65,Editing my review. The setup will fail if wifi is enabled and you will likely get the error 1006 as I did and noted in my original review. Turn off wifi per other reviewers suggestions and you should be fine. Giving 3 stars due to the poor qa and setup experience.,"State of New Jersey  ApplicationsOctober 7, 2020We are really sorry for the trouble and we appreciate you bringing this issue to our attention. We are working to resolve the issue."
Alberto Hamade,Rated 3 stars out of five stars,7-Oct-20,136,"Still don't understand when to use covid Check-in button. Is it used when you have been diagnosed with covid, or do you just use it to let the system know you feel well regardless of whether you think you may have covid? I'm afraid of pressing the button because I feel like it will think I have Covid. Please explain in plain English what makes the app label you as covid positive.","State of New Jersey  ApplicationsOctober 7, 2020Hi Alberto, You will only be labeled as COVID positive if you receive a positive COVID test, receive a call from a contact tracer and agree to upload a positive verification pin to the app. The check-in button is a feature for people to use if they want to keep track of any new symptoms they have; you don't have to use it if you don't want to."
Josh Epstein,Rated 3 stars out of five stars,9-Oct-20,3,"I really like the idea of this app, but unfortunately it drained the battery on my phone super fast. I have a nearly 3 year old Galaxy S8, so that could contribute. I want to have this app, everyone should, but I can't keep it on my phone for now.",
Aj Mesteri,Rated 3 stars out of five stars,26-Oct-20,3,I have this app in my phone but in order to make it more effective it needs more advertise and insist ppl to download it. It can only work more ppl uses and learn how to use it properly. I also not sure myself when its says it use bluetooth in order to make it work. Does it mean I require to wear actual blutooth on my year? Many ppl didnt even know that NJ has this app. Otherwise its a good idea.,
Ari Birnbaum,Rated 3 stars out of five stars,7-Feb-21,1,The app icon went from filling in the whole circle to becoming an unreadable tiny square in a circle.,
Xiomara Mora-Lopez,Rated 3 stars out of five stars,1-Oct-20,28,Downloaded using my home WiFi.. Does not work. Error 1002 **Read reviews below that said Turn Off WiFi and download using cellphone data only. Works PERFECTLY NOW.,
Kurokari,Rated 3 stars out of five stars,5-Nov-20,8,Even though I have exposure alerts on it seems to only do a scan if I open the app itself. Shouldn't it do this automatically daily?,
Michelle Miguelino,Rated 3 stars out of five stars,1-Oct-20,6,"I'm happy to use this app, but I couldn't set it up when on wifi. I needed to use my data plan.","State of New Jersey  ApplicationsOctober 7, 2020Hi Michelle, Feel free to turn Wi-Fi back on after setting it up. The exposure notification system does not require internet to function, so after set-up you can turn the Wi-Fi back on. Statistics may not load, but the main function of the app is working. We're working to fix this error now."
Michael Lake,Rated 3 stars out of five stars,1-Oct-20,11,App won't work. Keeps displaying an error code.,"State of New Jersey  ApplicationsOctober 7, 2020Hi Michael, Please try turning off the Wi-Fi during setup. Feel free to turn Wi-Fi back on after setting it up. The exposure notification system does not require internet to function, so after set-up you can turn the Wi-Fi back on. Statistics may not load, but the main function of the app is working. We're working to fix this error now."
Aakaash Jois,Rated 3 stars out of five stars,7-Oct-20,12,Turn off Wifi to get started. Not sure why this is not required for the Covid Alert NY app.,"State of New Jersey  ApplicationsOctober 7, 2020Hi Aakaash, Please try turning off the Wi-Fi during setup. Feel free to turn Wi-Fi back on after setting it up. The exposure notification system does not require internet to function, so after set-up you can turn the Wi-Fi back on. Statistics may not load, but the app is working. We're working to fix this error now."
Jack Franks,Rated 3 stars out of five stars,7-Oct-20,8,Needs bluetooth to always be on for it to work.,"State of New Jersey  ApplicationsOctober 7, 2020Hi Jack, That's correct. The exposure notification system relies on Bluetooth to detect other devices in the area. That way we can protect your privacy and not use GPS location tracking data, while still being able to figure out who may have been exposed to a COVID positive person."
Rockstarp88 Drummer,Rated 3 stars out of five stars,7-Oct-20,2,I tried going through the data thing. But it's saying that there's an error,"State of New Jersey  ApplicationsOctober 7, 2020Hi, Please try turning off the Wi-Fi during setup. Feel free to turn Wi-Fi back on after setting it up. The exposure notification system does not require internet to function, so after set-up you can turn the Wi-Fi back on. Statistics may not load, but the app is working. We're working to fix this error now."
Michael White,Rated 3 stars out of five stars,12-Oct-20,4,"Easy to install. My only question is how does it know you have been in contact with someone personally? How is connecting the dots, so to speak?",
Pavel Vaynshtok,Rated 3 stars out of five stars,23-Feb-21,0,no data update for several days,
Tom Dennison,Rated 3 stars out of five stars,15-Nov-20,1,Just really want to know if the app talks to the NY and PA apps? I deal with people from both daily.,
Hopkins The Movie,Rated 3 stars out of five stars,18-Jan-21,2,The numbers for confirmed cases and deaths are wrong.,
Carl Weidenburner,Rated 3 stars out of five stars,3-Oct-20,3,Does not work if WiFi is on,"State of New Jersey  ApplicationsOctober 7, 2020Hi Carl, Feel free to turn Wi-Fi back on after setting it up. The exposure notification system does not require internet to function as it works exclusively through the operating system and Bluetooth, so after set-up you can turn the Wi-Fi back on. Statistics may not load consistently, but the app is working. We're working to fix this error now."
Dominick Williams,Rated 3 stars out of five stars,11-Feb-21,0,Never received any alerts,
Stephen Savona,Rated 3 stars out of five stars,7-Oct-20,1,You must turn wifi off to use this app on your phone.,"State of New Jersey  ApplicationsOctober 7, 2020Hello, Thank you for your response. Rest assured that even when you are on Wi-Fi, the exposure notification system is still working. The main function of the app relies only on the operating system and Bluetooth. After set up, please feel free to turn Wi-Fi back on. We are working to fix the bug."
william diaz,Rated 3 stars out of five stars,7-Oct-20,4,covid numbers not updated regularly,"State of New Jersey  ApplicationsOctober 7, 2020Hi William, Thank you for your message. The numbers on the main graphs are updated daily at 12pm. We're working on changing the data presentation so that you can look at more granular information for both the main graphs and the counties."
Robert M Deems,Rated 3 stars out of five stars,18-Nov-20,0,I Certainly can't actually Rate something I just got.,
Quaeesha Coppedge,Rated 3 stars out of five stars,10-Oct-20,1,Fast download..!!👍🏾,
Stella Weiner,Rated 3 stars out of five stars,13-Dec-20,0,Rite aid Cov 19 testing,
chris austin,Rated 3 stars out of five stars,30-Jan-21,0,Okay,
David Levine,Rated 4 stars out of five stars,7-Jun-21,8,Application does not startup with 6-7-21 update. Please fix.,
Arpad Pusztai,Rated 4 stars out of five stars,3-May-21,3,"More and more people gets vaccinated; you should add this option to the app, too.",
Karen Leonetti,Rated 4 stars out of five stars,30-Mar-21,4,I would like to see data where my phone randomly had contact with another device?,
Albert Endler,Rated 4 stars out of five stars,18-May-21,2,Needs a COVID-19 immunization option and ID,
Melissa Edwards,Rated 4 stars out of five stars,16-Nov-20,269,I think the app is great. Very informative. It's all in one spot. You do not have to have bluetooth on all the time. You can switch it on when you would like to use it then switch it back off. Without bluetooth you are still able to access and use all of the other features like covids daily numbers local/global/etc and also you are able to check in with how you are feeling and report symptoms..just another tool in the fight against covid.,
Harshada Prabhune,Rated 4 stars out of five stars,8-Oct-20,25,Edit - works perfectly after turning off wifi during setup. Got an immediate response from the developer on the workaround. Does not work. Error code 1002. This error is displayed after I confirm my age and press continue. I have a OnePlus 6t phone (android),"State of New Jersey  ApplicationsOctober 8, 2020Hi! Please try turning off the Wi-Fi during setup. Feel free to turn Wi-Fi back on after setting it up. The exposure notification system does not require internet to function, so after set-up you can turn the Wi-Fi back on. Statistics may not load, but the app is working. We're working to fix this error now."
Nathan Henderson-James,Rated 4 stars out of five stars,7-Oct-20,209,"UPDATE: Working now per comment from developer. I can't get the app to work on my Galaxy S10. It installs, I affirm I'm over 18, and on the data sharing page I get an error code 1002 and can't move on. I've tried uninstalling and reinstalling and get the same problem. I do not have this problem on the VA COVID app I also have on my phone.","State of New Jersey  ApplicationsOctober 7, 2020Hi Nathan, Please try turning off the Wi-Fi during setup. Feel free to turn Wi-Fi back on after setting it up. The exposure notification system does not require internet to function, so after set-up you can turn the Wi-Fi back on. Statistics may not load, but the app is working. We're working to fix this error now."
Jeanne Ortiz,Rated 4 stars out of five stars,11-Oct-20,12,"I'm not sure I understand how it works re. sharing the positive result so other people can be alerted. I read the app info /learn how it works several times so I must be missing something. Is the assumption that the person go anywhere to take a C19 test and wait for a representative to call them? If so, how would the representative know that you tested positive?",
Jeff Mazzola,Rated 4 stars out of five stars,26-Dec-20,4,"Need to have an option to change the ""How are you feeling?"" response for when you select the incorrect response by mistake.",
polikwaptiwa che,Rated 4 stars out of five stars,1-Oct-20,47,I used regular data plan and no WiFi to install app. Now the app is fully functional. Further report to follow after I use the app for a while.,
Regina Ford,Rated 4 stars out of five stars,9-Oct-20,9,I keep getting error after I click continue. It says Sorry that didn't work properly (error code 1002).,
James R,Rated 4 stars out of five stars,1-Oct-20,8,Dont use ur wifi but only use data from cell. It will work,
Jeremy Lopez-Hernandez,Rated 4 stars out of five stars,24-Jan-21,2,Help us stop the spread of COVID-19 in New Jersey! COVID Alert NJ App is being made available by the New Jersey Department of Health (DOH) to complement New Jersey’s comprehensive COVID-19 contact tracing effort. COVID Alert NJ is a free and secure mobile phone app that allows New Jerseyans: 1. To be alerted if they have been in close contact with another app user who has tested positive for COVID-19 – even if that person is a stranger 2. To track their symptoms and get advice on what to do to,
Anna Petruccelli,Rated 4 stars out of five stars,11-Oct-20,1,I just downloaded app cant give any feed back at this time. Thanks,
Frederico Freitas,Rated 4 stars out of five stars,2-Oct-20,5,better late than never. the app is good now is for people to use it and be honest about it.,
Veda Gundanna,Rated 4 stars out of five stars,6-Jan-21,2,It should show where I am in the queue for vaccination.,
Salvatore Marino,Rated 4 stars out of five stars,12-Dec-20,1,Optimistic about the potential.,
Stephanie Jeanne Zogg,Rated 4 stars out of five stars,11-Dec-20,0,I like that you can take a moment to store daily check ups. SJZ,
Joe White,Rated 4 stars out of five stars,16-Nov-20,0,"To work everyone needs to use it, otherwise you could be exposed by someone who doesn't use this",
Heather Bruno,Rated 4 stars out of five stars,17-Nov-20,1,This is a very informative app.,
Robert McDermott,Rated 4 stars out of five stars,1-Oct-20,10,Can't be on wifi to set this up,
Peg Ewald,Rated 4 stars out of five stars,8-Jan-21,1,Want info on getting vaccine !!,
David Cordero,Rated 4 stars out of five stars,19-Oct-20,1,Doing our part to end Covid19!,
David Watts,Rated 4 stars out of five stars,13-Apr-21,0,WATTS121353,
Diana Cooper-Vanderlip,Rated 4 stars out of five stars,30-Nov-20,0,Informative,
Elijah Holloman,Rated 4 stars out of five stars,21-Feb-21,0,bi.d.e.n,
Jose Beniquez,Rated 5 stars out of five stars,9-Jun-21,3,Great app it keeps you up with what's going on with the covid in your area.,
Christopher Gagliardi,Rated 5 stars out of five stars,9-Jun-21,1,I've been trying to use the app since yesterday and it's not working can you please kindly fix it,
Kevin Ballenger,Rated 5 stars out of five stars,7-Mar-21,65,"I LOVE THIS APP! I Live In Essex County, NJ Which Is The 2nd Highest In The State. While Taking NJ Transit Yesterday, I Actually Received An Exposure Alert While On The Bus! I Immediately Got Off The Bus, And Waited For The Next One, And The Exposure Alert Stopped!",
Ray Wodanson,Rated 5 stars out of five stars,16-Mar-21,18,"Has done what it says. As long as other people have this on their phone you are safer. It always you if someone nearby has had covid-19, as long as they use the app.",
Ryan Volk,Rated 5 stars out of five stars,24-Apr-21,2,Works. It just works.,
ThatOneStopMotioner,Rated 5 stars out of five stars,28-May-21,0,"Helps by putting all information in one place, THANK YOU!",
Abo Obama,Rated 5 stars out of five stars,16-Mar-21,2,It's the best app and with very accurate information.,
Jeff Ceeckler,Rated 5 stars out of five stars,24-Dec-20,41,I feel like if more people used this app it could help in lowering the cases in NJ. So the app senses if you come in contact with somebody that has covid. I have not ever been contacted so I'm not really sure if enough ppl are using the app or if I have been really lucky. Im pretty sure more people need to have the app in order for it to make a difference.,
Dawn Peterson,Rated 5 stars out of five stars,30-May-21,0,"Use it everyday, how ever when I am in a store and a person does not have the app you can't anything. So I thought it was worthless and deleted it.",
Barbara A Talley,Rated 5 stars out of five stars,11-Jun-21,0,"Stii loading why, beyond me, still trying to load🙏Still LOVE the app.",
dac5190,Rated 5 stars out of five stars,5-Oct-20,213,"Installed with zero issues on an Pixel 4a running Android 11. After setting up the app, my COVID-19 Exposure Notification API (in the Google settings) updated to finally change to On. This means this application is ACTUALLY using the Google and Apple official API package. So excited to be part of the solution, not part of the problem.",
Diana S.,Rated 5 stars out of five stars,9-Oct-20,106,I had no problems installing on Galaxy Note 20. I think the app is a great idea. I just wish the general public would embrace it instead of fearing it. Some view it as a threat to privacy and simply don't understand how it actually works. A bigger PR campaign is needed I think.,
VJ D,Rated 5 stars out of five stars,1-Oct-20,193,"NOTE: Based on previous reviewers, I turned off wifi before trying to download. I had no issues at all during the quick download process; the app walked me thru setup (with brief explanations, but I'd already read about how it works). So fat, I'm pleased. Now let's so how it performs...",
Lamecca Adams,Rated 5 stars out of five stars,8-May-21,1,Easy to used. Informative and relevant; also reliable,
Theresa Burtulato,Rated 5 stars out of five stars,7-Oct-20,30,Easy fast to download . I like it I think it's great app to have on my phone because it helps me to feel just a little more safe going outside the only thing is my battery power is not lasting as long for some reason. Who knows? It is worth it to me I'll just charge up more often,
Maryellen Greiss,Rated 5 stars out of five stars,30-Dec-20,0,"The Covid- 19 alert app is only good ""if you have bluetooth"" 😣😞 in which i do not have,",
Linda Pappert,Rated 5 stars out of five stars,11-Feb-21,3,Very helpful in staying up to date with county and state covid statistics.,
