name,ratings,date,helpful,comment,developer_comment
Christine F,Rated 1 stars out of five stars,13-Jun-21,1,App wont open anymore. I saw on the news that some states are beginning to eliminate reporting daily covid numbers due to the high amount of declining cases. This could be why the app isn't working anymore.,
AL G,Rated 1 stars out of five stars,21-Apr-21,47,"This app is becoming increasingly useless as the number of people getting fully vaccinated increases, and as it fails to gather vaccination data. IF THIS CONDITION CONTINUES, I'LL HAVE NO CHOICE BUT TO UN-INSTALL THIS APP. I SUGGEST THAT OTHERS DO THE SAME. I suggest changing the data that you gather to include: - vaccination info (if obtained, what type, when #1, when #2, etc) - positive/negative test results - self-reported symptoms. All the above can be very useful public health data.",
Owen Iozzio,Rated 1 stars out of five stars,7-Jun-21,100,Instantly crashes when launching after latest update,
Chris Etler,Rated 1 stars out of five stars,8-Apr-21,30,"Since the app came out only 1500 people have even entered their contact tracing number, despite thousands of cases a day. Without proper contact tracing this app is useless",
Mike Ehrmann,Rated 1 stars out of five stars,3-May-21,40,Stats like deaths and hospitalizations hasn't been updated in a month or more. Other stats are sometimes days late. Information has become useless. What else does this do besides track us?,
T Sab,Rated 1 stars out of five stars,8-May-21,9,"Work in ER, around Covid patients constantly. Never alerted once. So there is clearly not enough user base for this app to be effective.",
Roibeárd Billson,Rated 1 stars out of five stars,8-Mar-21,72,"Still does not work for me. Tried turning off WiFi & Bluetooth—no difference. Gives ""Error 104"" —totally unhelpfull. Uninstalling. For those complaining about vaccine being unavailable, well it is NJ. We don't do anything sensibly. In my area, there 3 websites (State, Atlantic Health & RWJ). All are unconnected, so need register on all 3—and wait. Seriously? 😠",
Donna Phelan,Rated 1 stars out of five stars,1-Mar-21,87,"Ĺeads you to believe it will let you know where to get vaccinated. Nj has the worst system as it relates to vaccines. It so simple, every area code has there own site, if you prove you live in that zip, you can get vaccinated. Its a no brainer, but the state has NO CLUE!!!",
Bonnie Meigs,Rated 1 stars out of five stars,18-Mar-21,21,"Uninstalling. Does not give exposure alerts. I did not update the app to say I had covid, but the state knows and called me. I don't get exposure notifications when I'm at my house. The whole reason I downloaded this was to be notified of possible exposure and I have never gotten a notification ever. Waste of time.",
Daniel MacMahon,Rated 1 stars out of five stars,9-Mar-21,13,"Has ANYONE on this review thread been notified of a positive Covid-19 contact? Anyone? I was encouraged to download and use this app when I was first tested in Union County. I checked in with my status every day, for many months. I have NEVER been notified of a potential Covid-19 exposure. As a first responder, I know that I have been within close contact with dozens of Covid-positive people. I have lost confidence that this is a valid weapon against the continuing pandemic.",
Shawn Roberts,Rated 1 stars out of five stars,21-Mar-21,4,"This app is useless to users. I've been close, very close, to at least 5 people who have all gotten Covid, none of them caused any notification to my app. I also know that the contact tracers were only asking if they knew about the app, not to do anything to trigger the positive notifications. I know notifications are on because I get one monthly to remind me it's running, well, got one monthly, I have since uninstalled it because it's useless to me as an end user.",
J Newt,Rated 1 stars out of five stars,26-Dec-20,112,"Absolutely worthless. Contracted covid from a person that contracted covid while in hospital. The contact tracer was not able to get the 6 digit code I needed for the app. Also Drs are refusing to test likely positive people. There's no way to use the app as intended without a test or a code, don't bother with the invasion of privacy.",
Brian Gallagher,Rated 1 stars out of five stars,1-Jan-21,141,"I tested positive yesterday, but there is no way to tell the app. I can only report symptoms. Apparently I need a 6 digit code from some health department to let the app know I was positive. So until I get that code nobody who was in proximity to me will get a notification and will therefore keep spreading the 'rona.",
Penelope Lopez,Rated 1 stars out of five stars,22-Dec-20,32,"Your ""ENABLE EXPOSURE ALERT"" button has not worked since its launch. Gone into settings > exposure alert > enable and NOTHING. Have an Android phone but know of iPhone users with the same problem. Located in Morris County, NJ. PLEASE FIX THIS!!",
Ines Bosi,Rated 1 stars out of five stars,20-Mar-21,3,Don't work!! Just useless. Deinstalling.,
Mel G,Rated 1 stars out of five stars,21-Dec-20,13,Not very helpful. I've NEVER been alerted of being or coming into contact with someone whose known to have covid19. This app is just an invasion of my privacy!,
R M,Rated 1 stars out of five stars,5-Dec-20,3,"Not very useful. The app only works, if someone who had or has COVID is using it too! It DOES NOT just detect people with Covid and alert you. I uninstalled it after a week of nothing and especially after 5 people tested positive where I work and the app never alerted me! It's really a waste of time.",
Emily Luedeman,Rated 1 stars out of five stars,4-Nov-20,300,Work in an emergency room and downloaded to see how accurate the alerts would be. I assumed I would have to turn off the notification from being alerted to much. To my surprise I haven't been alerted once in over a month of having the app even after being in direct patient care with positive cases.,
Taxey Driver,Rated 1 stars out of five stars,17-Nov-20,66,Not very useful.: 1. You must have and utilize a smart phone 2. You must have it activated 3. You must report your status daily 4. You must be in close contact with an infected person for too long and they must have reported they have symptons 5. Will it be compatable with apps from other states,
Jordan Shi,Rated 1 stars out of five stars,29-Oct-20,50,Cannot even finish setup poor development. Simple alert app should not be inconvenient to use if it is most people won't go through the headache of setting it up. This fix should be top priority. Poor development something like this should be more easily usable.,
Lior Gotian,Rated 1 stars out of five stars,16-Oct-20,63,Graphs of the data are basically useless without the ability to filter on the last 30 days. The data from March-April dominates the plotted ranges which makes it difficult to determine the actual covid cases and deaths that are occurring now.,
Blank Biermanoski,Rated 1 stars out of five stars,3-Oct-20,12,"Once you tap on the option ""Exposure Alert"" to Activate, then you can't turn it off! And so it's using up my Data to perform checks when I'm all alone! I just Uninstalled the thing.","State of New Jersey  ApplicationsOctober 7, 2020Hi Jean, you can turn off Exposure Alerts at any time through settings in the operating system on your phone. The app has no way to access any of your other apps or any of your data besides the random codes it collects from other devices in the area with the app. If you have other questions about how the app works, please email covidapp@doh.nj.gov"
Janet Kazarowski,Rated 1 stars out of five stars,10-Nov-20,3,"I spend most of my time at home, and this app constantly harasses me to turn on my location. I use my phone a lot, and I don't want to waste the battery. This is more inconvenient to me than it is helpful.",
Mayra Amaral,Rated 1 stars out of five stars,2-Oct-20,24,Can't get pass the 2nd screen during the setup process.error code 1002 (Your Data page) uninstalling until you get your act together and fix this.,
Matthew Nichols,Rated 1 stars out of five stars,21-Oct-20,18,"I get to the getting started screen and my phone freezes and then says app isn't responding. I've tried on WiFi, ice tried with WiFi off. Same result each time.",
Joseph Merlino,Rated 1 stars out of five stars,6-Dec-20,3,Totally useless. We had people saying they had it just to set off red flags. This is based on the honor system and that hasn't been something people done in a very long time.,
Cristino Aquino,Rated 1 stars out of five stars,14-Oct-20,19,"Numbers are not being updated ""Current COVID hospitalization"" has remained unchanged for weeks (459) I will uninstall app and consider reinstalling if issue is fixed.",
Monique Evans,Rated 1 stars out of five stars,7-Oct-20,3,"After initial set-up, there is an ""error 1002"" code. The app has that one bug.","State of New Jersey  ApplicationsOctober 7, 2020Hi Monique, Please try turning off the Wi-Fi during setup. Feel free to turn Wi-Fi back on after setting it up. The exposure notification system does not require internet to function, so after set-up you can turn the Wi-Fi back on. We're working to fix this error now."
Brian Kash,Rated 1 stars out of five stars,25-Mar-21,3,This app plus $1.50 geta you the star ledger. Useless.,
Sandy Mele,Rated 1 stars out of five stars,15-Nov-20,7,Having Bluetooth on always is not realistic plus it never alerted once. Dont waste the space on your phone for this app. Very disappointing,
Giankarlo Guirao,Rated 1 stars out of five stars,1-Dec-20,6,It keeps freezing after verifying my age. Still not working for me. I have a galaxy 8+.,
Rainey J,Rated 1 stars out of five stars,5-Oct-20,8,"Its not working. Saying ""error loading page"" for two days straight. I uninstalled & re installed, same message","State of New Jersey  ApplicationsOctober 7, 2020Hi Rainey, Please try turning off the Wi-Fi during setup. Feel free to turn Wi-Fi back on after setting it up. The exposure notification system does not require internet to function, so after set-up you can turn the Wi-Fi back on. Statistics may not load, but the app is working. We're working to fix this error now."
Joanne,Rated 1 stars out of five stars,14-Nov-20,8,"The stupidest app ever. It is relying on the people who use it to be honest and informed. Right! Come on, how likely is that? Verification pin? Your still relying on people to admit they might be sick, get tested and then be honest enough to share that info. Good luck with that. Also. The people who are at the most risk are the ones who are the least likely to know how or want to use a cell phone app","State of New Jersey  ApplicationsOctober 8, 2020Hi Joanne, Uploading a positive requires a verification pin provided by the Department of Health after a positive COVID test. No need to rely on honesty. Thank you for your comment."
Eric Lugay,Rated 1 stars out of five stars,10-Oct-20,13,"This application shouldn't just depend on Bluetooth to operate, it should use a Wi-Fi signal. I hate turning on my Bluetooth, don't think it's safe for my health.",
JJScene,Rated 1 stars out of five stars,15-Oct-20,2,"It just... doesn't get past the start page. Please, ask someone to help you fix this app.",
Tom Trubac,Rated 1 stars out of five stars,3-Oct-20,16,"Would like for it to work. But getting error code 104. Tried downloading and installing with no wifi, and still no good.","State of New Jersey  ApplicationsOctober 7, 2020Hi Tom, please email covidapp@doh.nj.gov so that I can help you work out your error."
Kimberly Barton,Rated 1 stars out of five stars,4-Oct-20,4,I can't get the app to work on my Galaxy S9. I verified I'm over 18 and on the permission page I can't continue; I received an Error code 1002. I work in retail and would love to now if I'm in any further danger!,"State of New Jersey  ApplicationsOctober 7, 2020Hi Kimberly, Please try turning off the Wi-Fi during setup. Feel free to turn Wi-Fi back on after setting it up. The exposure notification system does not require internet to function, so after set-up you can turn the Wi-Fi back on. Statistics may not load, but the app is working. We're working to fix this error now."
John Fischer,Rated 1 stars out of five stars,17-Oct-20,2,Not made for Chromebook. Most of the app is chopped off and missing. This is made for phones only it seems.,
Anita Bastow,Rated 1 stars out of five stars,1-Oct-20,12,Can not get past screen turning on alerts. Error code 1002.,"State of New Jersey  ApplicationsOctober 7, 2020Hi Anita, Please try turning off the Wi-Fi during setup. Feel free to turn Wi-Fi back on after setting it up. The exposure notification system does not require internet to function, so after set-up you can turn the Wi-Fi back on. Statistics may not load, but the app is working. We're working to fix this error now."
DJ Salrus,Rated 1 stars out of five stars,7-Nov-20,6,Looks like it a 3 year old designed it and the check in feature makes no sense,
Eileen Gardner,Rated 1 stars out of five stars,5-Oct-20,7,Doesn't work on my Galaxy note. I get an error message. Might be my settings.,"State of New Jersey  ApplicationsOctober 7, 2020Hi Eileen, Please try turning off the Wi-Fi during setup. Feel free to turn Wi-Fi back on after setting it up. The exposure notification system does not require internet to function, so after set-up you can turn the Wi-Fi back on. Statistics may not load, but the app is working. We're working to fix this error now."
Jody Ross,Rated 1 stars out of five stars,19-Mar-21,0,Doesn't help where you can be vaccinated & when,
brf H dryhfK,Rated 1 stars out of five stars,11-Oct-20,8,Bluetooth is required to be on all the time and the features are hard to understand,
Dave Giffin,Rated 1 stars out of five stars,25-Nov-20,2,Does not work. Good idea but shame on NJ for not developing it right so it works. This could really keep people safe if they did it right. Dissapointing but thats no surprise given our government and the state of the world.,
David Bradley,Rated 1 stars out of five stars,26-Oct-20,5,104 error when trying to use the app. Turning off wifi doesn't work,"State of New Jersey  ApplicationsOctober 7, 2020Hi David, Please try turning off the Wi-Fi during setup. Feel free to turn Wi-Fi back on after setting it up. The exposure notification system does not require internet to function, so after set-up you can turn the Wi-Fi back on. Statistics may not load, but the app is working. We're working to fix this error now."
Jan Zientek,Rated 1 stars out of five stars,3-Oct-20,8,"Does not run on my Samsung Note 10+, should be zero stars....and no tech support","State of New Jersey  ApplicationsOctober 7, 2020Hi Jan, please email covidapp@doh.nj.gov for help with your error."
Bob Smeltzer,Rated 1 stars out of five stars,14-Oct-20,7,"Is our health department this bad? You cannot stop the spread. Its not possible. You can slow the spread, as a matter of fact thats what the CDCs goal is to slow the curve. Social distancing and wearing masks will just slow the spread. Standing 6 ft away from people and wearing masks doesnt make you immune to the disease. Its been proven to travel past 6 feet and can survive on things like your cell phone for hours. This is bad information that will give people a false sense of security",
Alex Karpodinis,Rated 1 stars out of five stars,16-Feb-21,2,Death transparency is gone. What are you hiding?,
Paul Liuzzo,Rated 1 stars out of five stars,1-Oct-20,14,Doesn't work I get an error code. Maybe year before distributing,"State of New Jersey  ApplicationsOctober 7, 2020Hi Paul, Please try turning off the Wi-Fi during setup. Feel free to turn Wi-Fi back on after setting it up. The exposure notification system does not require internet to function, so after set-up you can turn the Wi-Fi back on. Statistics may not load, but the app is working. We're working to fix this error now."
Laura K,Rated 1 stars out of five stars,24-Oct-20,3,"Inaccurate figures. Today news reports 800+ hospitalizations in NJ, and the app says 172. What's the purpose of this if it's not even factual???",
Rich Feldman,Rated 1 stars out of five stars,6-Oct-20,5,Error 1002 when trying to use. Won't run,"State of New Jersey  ApplicationsOctober 7, 2020Hi Rich, Please try turning off the Wi-Fi during setup. Feel free to turn Wi-Fi back on after setting it up. The exposure notification system does not require internet to function, so after set-up you can turn the Wi-Fi back on. We're working to fix this error now."
David Jin,Rated 1 stars out of five stars,26-Nov-20,2,"I don't have Covid yet... But this app seems to assume everyone has COVID, and don't have COVID was not an option... So how is this going to help me as a doctor who comes in contact with patients daily....",
Rich DeHainaut,Rated 1 stars out of five stars,19-May-21,2,"Why would you even install this app ? Why would you want the government to track you ? You shouldn't allow government to have total control over everything you do. It's time for people to wake up and stop being lazy, scared, and crybabies.",
Aidan Martir,Rated 1 stars out of five stars,14-Oct-20,10,This isn't Orewellian enough. Where's the feature to call the authorities on someone who's breaking quarantine? Maybe start making armbands for the infected. Stars maybe?,
iyaoyi,Rated 1 stars out of five stars,1-Oct-20,7,Got api error: google exposure notification api not available on this device,
Sathya Narayan,Rated 1 stars out of five stars,12-Oct-20,5,It just doesn't work on a phone like Galaxy S10 plus,
Maryse Bloom,Rated 1 stars out of five stars,16-Oct-20,2,New phone and this app doesn't download on wifi or data.,
Normal Nobody,Rated 1 stars out of five stars,21-Oct-20,11,"Invasive. I'm not walking around with an app checking for covid people, or sending out a signal I might have it. Straight out of a horror movie! Paranoia against our neighbors and community, anyone? Want me to wear a little sticker that says I'm ""infected,"" or ""not infected,"" especially with flu season coming up, come on guys. This is awful. I'm not going to check the guy on line if he has a little red tracer around him. I see the problems that will happen & no way will be part of it. Grow up!",
Dee Perry,Rated 1 stars out of five stars,3-Oct-20,2,Doesn't work. Got error code 1002.,
Ken,Rated 1 stars out of five stars,6-Dec-20,3,"There's no way to indicate that you got COVID.l, for the app to even work. Both my gf and I have the app. I got COVID and it never told her. (And she got covid from me)",
Vinnie Smith,Rated 1 stars out of five stars,1-Oct-20,2,Doesn't work tried five times will not download,"State of New Jersey  ApplicationsOctober 7, 2020Hi Vinnie, Please email covidapp@doh.nj.gov so that I can assist you with your issue."
Amanda Ackerman,Rated 1 stars out of five stars,12-Dec-20,7,"When the Middlesex Co health dept called me 6 days after my + test, the woman I spoke with knew about the app, but knew nothing about giving me a 6 digit verification code. If it's not her job to give it out (as the app says it is), then whose it is? This app isn't working the way it claims to be. If people can't tell the app they're + then no close contacts are being alerted through the app. Why does the health dept (at least Middlesex Co) not know to give out this code?",
Robert Inzano,Rated 1 stars out of five stars,6-Oct-20,14,"Unnecessary app. This is government overreach. If I could give it negative stars, I would.","State of New Jersey  ApplicationsOctober 7, 2020Hi Robert, This app never access GPS or location data and it has no way of accessing any other apps on your phone. All information entered is voluntary and is not required for app usage. Some folks must still rely on public transportation or work in crowded situations. We're working to create solutions that can help the greatest number of folks."
David Farinick,Rated 1 stars out of five stars,13-Oct-20,3,Doesn t even work . What a joke .,
Melody Smith,Rated 1 stars out of five stars,11-May-21,0,It's never updated,
George Flynn,Rated 1 stars out of five stars,6-Oct-20,2,I have downlozded the ap vut it only allowed me to go part way. I I get an error code 1002.,"State of New Jersey  ApplicationsOctober 7, 2020Hi George, Please try turning off the Wi-Fi during setup. Feel free to turn Wi-Fi back on after setting it up. The exposure notification system does not require internet to function, so after set-up you can turn the Wi-Fi back on. We're working to fix this error now."
Scott S.,Rated 1 stars out of five stars,6-Oct-20,43,"Welcome to the peoples republic of new jersey. The state wants you to install a tracking app that is always running in the background, what could possibly go wrong. We don't need a tracking app to protect ourselves from the China Virus, just use common sense, wear a mask and don't mingle with strangers.","State of New Jersey  ApplicationsOctober 7, 2020Hi Scott, This app never access GPS or location data and it has no way of accessing any other apps on your phone. All information entered is voluntary and is not required for app usage. Some folks must still rely on public transportation or work in crowded situations. We're working to create solutions that can help the greatest number of folks."
Christine Grant,Rated 1 stars out of five stars,1-Jan-21,0,The contact alert feature is bordeine comsumer fraud .has it zctually od contact by anyone why are comments going oy back to decembet,
DrD. Dickinson,Rated 1 stars out of five stars,22-Mar-21,0,"Doesn't do a damn bit of good, unless you plan to visit NJ",
Edward Powers,Rated 1 stars out of five stars,1-Oct-20,8,"Same as others, can't get past set up.","State of New Jersey  ApplicationsOctober 7, 2020Hi Edward, Please try turning off the Wi-Fi during setup. Feel free to turn Wi-Fi back on after setting it up. The exposure notification system does not require internet to function, so after set-up you can turn the Wi-Fi back on. Statistics may not load, but the app is working. We're working to fix this error now."
laura briscese,Rated 1 stars out of five stars,5-Oct-20,1,Did not work. Got an error code,"State of New Jersey  ApplicationsOctober 7, 2020Hi Laura, Please try turning off the Wi-Fi during setup. Feel free to turn Wi-Fi back on after setting it up. The exposure notification system does not require internet to function, so after set-up you can turn the Wi-Fi back on. Statistics may not load, but the app is working. We're working to fix this error now."
Gary Olsen,Rated 1 stars out of five stars,6-Oct-20,2,Getting error code 1002 when trying to open,"State of New Jersey  ApplicationsOctober 7, 2020Hi Gary, Please try turning off the Wi-Fi during setup. Feel free to turn Wi-Fi back on after setting it up. The exposure notification system does not require internet to function, so after set-up you can turn the Wi-Fi back on. We're working to fix this error."
YILMAZ AKSU,Rated 1 stars out of five stars,21-Nov-20,1,I haven't seen anyone reported positive yet.,
Rob M,Rated 1 stars out of five stars,18-Jan-21,2,Shows negative daily deaths,
BJ PL,Rated 1 stars out of five stars,6-Oct-20,8,battery and system hog,
Ilya Kaplan,Rated 1 stars out of five stars,12-Dec-20,2,Doesn't do anything useful.,
Dominick Cirianni,Rated 1 stars out of five stars,30-Oct-20,4,Total Control over all of us.,
John O'Donnell,Rated 1 stars out of five stars,6-Oct-20,4,It doesn't work!,"State of New Jersey  ApplicationsOctober 7, 2020Hi John, Please try turning off the Wi-Fi during setup. Feel free to turn Wi-Fi back on after setting it up. The exposure notification system does not require internet to function, so after set-up you can turn the Wi-Fi back on. We're working to fix this error now."
Jeffrey Cash,Rated 1 stars out of five stars,6-Oct-20,2,Man and woman is a tging,
Lucille Maraschiello,Rated 1 stars out of five stars,16-Jun-21,0,Do not live near here,
Jayne Kaito,Rated 1 stars out of five stars,28-Apr-21,0,Will never alkow my gov. To put out that im sick with covid if i was thats not right and the person who develoved the app ahould ve fined,
Anthony T,Rated 1 stars out of five stars,6-Jan-21,2,2019 US deaths be4 Pandemic: 2.85 mil 2020 US deaths After Pandemic: 2.83 mil Per C.D.C. Say no to fascism. Say no to this garbage app..,
Michael Luis,Rated 1 stars out of five stars,22-Oct-20,8,Nj tax dollars at work. Highest death per mill. in usa. Solid use of funds jersey.,
Charlie Shousha,Rated 1 stars out of five stars,2-Oct-20,3,Error code 1002,"State of New Jersey  ApplicationsOctober 7, 2020Hi Charlie, Please try turning off the Wi-Fi during setup. Feel free to turn Wi-Fi back on after setting it up. The exposure notification system does not require internet to function, so after set-up you can turn the Wi-Fi back on. Statistics may not load, but the app is working. We're working to fix this error now."
CHERYL THOMAS,Rated 1 stars out of five stars,12-Jan-21,0,It's not mine but it's on my phone,
"CEO of Google, President of the USA Steven King",Rated 1 stars out of five stars,1-Jan-21,0,"#PRESIDENTSTEVENKING #STEVENKING I KNOW THE CURE FOR COVIDE, FDA APPORVED ME TO RESEarch",
Steve,Rated 1 stars out of five stars,25-Jan-21,1,nobody uses it,
James Spangler,Rated 1 stars out of five stars,21-Oct-20,9,Stop promoting this retarded app,
Lois Anthony,Rated 1 stars out of five stars,14-Oct-20,3,Not interested anymore,
rangers in4,Rated 1 stars out of five stars,6-Oct-20,13,Psycho Phil Murphy is a Marxist Dictator.,"State of New Jersey  ApplicationsOctober 7, 2020This app never access GPS or location data and it has no way of accessing any other apps on your phone. All information entered is voluntary and is not required for app usage. Some folks must still rely on public transportation or work in crowded situations. We're working to create solutions that can help the greatest number of folks."
